subject,type,questionText,options,correctAnswer,difficulty
Computer,choice,What does IP stand for?,Internet Protocol|Internet Program|Internal Protocol|Internal Program, Internet Protocol, 2
Computer,blank,The protocol used to transfer web pages is ______.,,HTTP,2
Computer,choice,"Which of the following is not a programming paradigm?","Procedural|Object-Oriented|Functional|Microsoft",Microsoft,3
Computer,choice,"What is the time complexity of the quicksort algorithm in the average case?","O(n)|O(n^2)|O(n log n)|O(log n)","O(n log n)",3
Computer,choice,Which of the following is a NoSQL database?,MySQL|PostgreSQL|MongoDB|Oracle,MongoDB,3
Computer,choice,"What is the name of the data structure used in the implementation of a web browser's back and forward buttons?","Queue|Stack|Tree|Linked List",Stack,3
Computer,choice,"Which of the following is a characteristic of the Agile software development methodology?","Big Design Upfront|Comprehensive Documentation|Iterative Development|Waterfall Model",Iterative Development,3
Computer,choice,"What is the purpose of the 'finally' block in Java exception handling?","To execute code regardless of whether an exception is thrown or not|To handle a specific type of exception|To create a new exception|To catch and rethrow an exception","To execute code regardless of whether an exception is thrown or not",3
Computer,choice,Which of the following is a type of computer network topology?,Ring|Mesh|Bus|All of the above,All of the above,3
Computer,choice,"What is the name of the algorithm used by search engines to rank web pages?","Bubble Sort|Merge Sort|PageRank|Quicksort",PageRank,3
Computer,choice,"Which of the following is a type of relation in the relational database model?","One-to-one|One-to-many|Many-to-many|All of the above","All of the above",3
Computer,choice,"What is the purpose of a virtual machine in the context of software development?","To translate high-level programming languages into machine code|To provide a platform-independent environment for running programs|To optimize code for better performance|To create graphical user interfaces","To provide a platform-independent environment for running programs",3
Computer,blank,The process of converting high-level programming language code into machine-readable code is called ______.,,compilation,3
Computer,blank,The ______ is the primary storage unit of a computer system.,,RAM (Random Access Memory),3
Computer,blank,The ______ protocol is used for sending and receiving email over the internet.,,SMTP (Simple Mail Transfer Protocol),3
Computer,blank,The ______ is the set of rules and conventions that govern how data is transmitted over a network.,,protocol,3
Computer,blank,"In the context of computer security, ______ is the process of identifying and authenticating users or devices.",,authentication,3
Computer,blank,The ______ is the set of instructions that tells the computer what to do.,,program,3
Computer,blank,The ______ is the smallest addressable unit of memory in a computer system.,,byte,3
Computer,blank,"The process of breaking down a complex problem into smaller, more manageable parts is known as ______.",,decomposition,3
Computer,blank,The ______ is a software component that manages system resources and provides services to other programs.,,operating system,3
Computer,blank,In computer networks ______ is the process of dividing data into smaller units for transmission and reassembling it at the destination.,,packet switching,3